{
  "$schema": "../contract.schema.json",
  "contract_id": "northwind.benefits",
  "tenant": "northwind",
  "version": "2.0.0",
  "description": "UNSAFE example: changes paid_amount to integer and drops PENDED without a value map. Expected to be rejected.",
  "entities": {
    "plan": {
      "description": "Benefit plan reference data.",
      "fields": {
        "plan_code": {
          "type": "string",
          "required": true,
          "nullable": false,
          "format": "alnum",
          "max_length": 12,
          "sensitivity": "public"
        },
        "plan_name": {
          "type": "string",
          "required": true,
          "nullable": false,
          "max_length": 120,
          "sensitivity": "public"
        },
        "plan_type": {
          "type": "enum",
          "values": [
            "HMO",
            "PPO",
            "EPO",
            "HDHP"
          ],
          "required": true,
          "nullable": false,
          "sensitivity": "public"
        },
        "deductible": {
          "type": "decimal",
          "precision": 10,
          "scale": 2,
          "min": 0,
          "required": true,
          "nullable": false,
          "sensitivity": "public"
        },
        "oop_max": {
          "type": "decimal",
          "precision": 10,
          "scale": 2,
          "min": 0,
          "required": true,
          "nullable": false,
          "sensitivity": "public"
        },
        "effective_date": {
          "type": "date",
          "required": true,
          "nullable": false,
          "sensitivity": "public"
        },
        "termination_date": {
          "type": "date",
          "sensitivity": "public"
        },
        "updated_at": {
          "type": "timestamp",
          "required": true,
          "nullable": false,
          "sensitivity": "internal"
        }
      },
      "key": [
        "plan_code"
      ],
      "correction": {
        "strategy": "supersede_by_order",
        "order_by": "updated_at"
      },
      "rules": [
        {
          "id": "oop_covers_deductible",
          "description": "Out-of-pocket maximum must be at least the deductible",
          "severity": "error",
          "assert": {
            "field": "oop_max",
            "op": "gte",
            "other_field": "deductible"
          }
        },
        {
          "id": "plan_dates_ordered",
          "description": "Termination date must not precede effective date",
          "severity": "error",
          "assert": {
            "field": "termination_date",
            "op": "gte",
            "other_field": "effective_date"
          }
        }
      ],
      "freshness": {
        "max_age_hours": 720
      }
    },
    "member": {
      "description": "Member eligibility (one current version per member).",
      "fields": {
        "member_id": {
          "type": "string",
          "required": true,
          "nullable": false,
          "format": "alnum",
          "max_length": 15,
          "sensitivity": "internal",
          "description": "Synthetic member identifier"
        },
        "ssn": {
          "type": "string",
          "max_length": 11,
          "sensitivity": "pii",
          "description": "Synthetic SSN (900-series, never valid)"
        },
        "first_name": {
          "type": "string",
          "required": true,
          "nullable": false,
          "max_length": 60,
          "sensitivity": "pii"
        },
        "last_name": {
          "type": "string",
          "required": true,
          "nullable": false,
          "max_length": 60,
          "sensitivity": "pii"
        },
        "date_of_birth": {
          "type": "date",
          "required": true,
          "nullable": false,
          "min": "1900-01-01",
          "sensitivity": "phi"
        },
        "gender": {
          "type": "enum",
          "values": [
            "F",
            "M",
            "U"
          ],
          "sensitivity": "phi"
        },
        "zip": {
          "type": "string",
          "format": "zip5",
          "sensitivity": "internal"
        },
        "plan_code": {
          "type": "string",
          "required": true,
          "nullable": false,
          "sensitivity": "public"
        },
        "coverage_start": {
          "type": "date",
          "required": true,
          "nullable": false,
          "sensitivity": "internal"
        },
        "coverage_end": {
          "type": "date",
          "sensitivity": "internal"
        },
        "status": {
          "type": "enum",
          "values": [
            "ACTIVE",
            "TERMINATED",
            "PENDING"
          ],
          "required": true,
          "nullable": false,
          "sensitivity": "internal"
        },
        "updated_at": {
          "type": "timestamp",
          "required": true,
          "nullable": false,
          "sensitivity": "internal"
        }
      },
      "key": [
        "member_id"
      ],
      "correction": {
        "strategy": "supersede_by_order",
        "order_by": "updated_at"
      },
      "relationships": [
        {
          "id": "member_plan",
          "field": "plan_code",
          "references": {
            "entity": "plan",
            "field": "plan_code"
          },
          "on_missing": "quarantine"
        }
      ],
      "rules": [
        {
          "id": "coverage_dates_ordered",
          "description": "Coverage end must not precede coverage start",
          "severity": "error",
          "assert": {
            "field": "coverage_end",
            "op": "gte",
            "other_field": "coverage_start"
          }
        },
        {
          "id": "dob_not_future",
          "description": "Date of birth cannot be after the file arrived",
          "severity": "error",
          "assert": {
            "field": "date_of_birth",
            "op": "not_after_arrival"
          }
        },
        {
          "id": "terminated_has_end",
          "description": "Terminated members must have a coverage end date",
          "severity": "error",
          "when": {
            "field": "status",
            "op": "eq",
            "value": "TERMINATED"
          },
          "assert": {
            "field": "coverage_end",
            "op": "not_null"
          }
        },
        {
          "id": "born_before_coverage",
          "description": "Coverage cannot start before date of birth",
          "severity": "warning",
          "assert": {
            "field": "coverage_start",
            "op": "gte",
            "other_field": "date_of_birth"
          }
        }
      ],
      "freshness": {
        "max_age_hours": 26
      }
    },
    "claim": {
      "description": "Medical claim header. Re-adjudications arrive with a higher adjudication_seq and supersede earlier versions.",
      "fields": {
        "claim_id": {
          "type": "string",
          "required": true,
          "nullable": false,
          "format": "alnum",
          "max_length": 20,
          "sensitivity": "internal"
        },
        "member_id": {
          "type": "string",
          "required": true,
          "nullable": false,
          "sensitivity": "internal"
        },
        "provider_npi": {
          "type": "string",
          "required": true,
          "nullable": false,
          "format": "npi10",
          "sensitivity": "public"
        },
        "service_date": {
          "type": "date",
          "required": true,
          "nullable": false,
          "sensitivity": "internal"
        },
        "received_date": {
          "type": "date",
          "required": true,
          "nullable": false,
          "sensitivity": "internal"
        },
        "diagnosis_code": {
          "type": "string",
          "required": true,
          "nullable": false,
          "format": "icd10",
          "sensitivity": "phi"
        },
        "billed_amount": {
          "type": "decimal",
          "precision": 12,
          "scale": 2,
          "min": 0,
          "required": true,
          "nullable": false,
          "sensitivity": "internal"
        },
        "allowed_amount": {
          "type": "decimal",
          "precision": 12,
          "scale": 2,
          "min": 0,
          "sensitivity": "internal"
        },
        "paid_amount": {
          "type": "integer",
          "required": true,
          "nullable": false,
          "sensitivity": "internal"
        },
        "status": {
          "type": "enum",
          "values": [
            "PAID",
            "DENIED",
            "PENDING",
            "REVERSED"
          ],
          "required": true,
          "nullable": false,
          "sensitivity": "internal"
        },
        "adjudication_seq": {
          "type": "integer",
          "required": true,
          "nullable": false,
          "min": 1,
          "sensitivity": "internal"
        },
        "line_of_business": {
          "type": "enum",
          "values": [
            "COMMERCIAL",
            "MEDICARE",
            "MEDICAID"
          ],
          "required": true,
          "nullable": false,
          "sensitivity": "internal"
        }
      },
      "key": [
        "claim_id"
      ],
      "correction": {
        "strategy": "supersede_by_order",
        "order_by": "adjudication_seq"
      },
      "relationships": [
        {
          "id": "claim_member",
          "field": "member_id",
          "references": {
            "entity": "member",
            "field": "member_id"
          },
          "on_missing": "warn"
        }
      ],
      "rules": [
        {
          "id": "paid_le_billed",
          "description": "Paid amount cannot exceed billed amount",
          "severity": "error",
          "assert": {
            "field": "paid_amount",
            "op": "lte",
            "other_field": "billed_amount"
          }
        },
        {